{
  "id": "veloria/r14_varco_cristallo",
  "version": 2,
  "displayName": "Varco di Cristallo",
  "biomeId": "snow_pass",
  "tiledAsset": "tilemaps/r14_varco_cristallo.tmj",
  "terrainBase": {
    "assetKey": "veloria-r14-crystal-pass-v1",
    "tilesetName": "veloria_terrain",
    "tileIndex": 0
  },
  "renderAssets": [
    {
      "kind": "tileset",
      "key": "veloria-ground-hd-v5",
      "path": "assets/tilesets/veloria-ground-hd-v5.webp",
      "tiledName": "veloria_terrain",
      "tileWidth": 254,
      "tileHeight": 510
    },
    {
      "kind": "image",
      "key": "veloria-npcs-v2",
      "path": "assets/sprites/veloria-npcs-v2.webp",
      "atlas": {
        "columns": 3,
        "rows": 2
      }
    },
    {
      "kind": "image",
      "key": "veloria-r14-crystal-pass-v1",
      "path": "assets/scenery/veloria-r14-crystal-pass-v1.webp"
    }
  ],
  "spawns": [
    {
      "id": "from_biancavetta",
      "x": 1,
      "y": 16,
      "facing": "right"
    },
    {
      "id": "from_cavern",
      "x": 34,
      "y": 6,
      "facing": "down"
    }
  ],
  "connections": [
    {
      "toMapId": "veloria/biancavetta",
      "viaSpawnId": "from_biancavetta",
      "targetSpawnId": "from_r14",
      "requiresFlags": []
    },
    {
      "toMapId": "veloria/d05_grotte_cristallo",
      "viaSpawnId": "from_cavern",
      "targetSpawnId": "from_r14",
      "requiresFlags": []
    }
  ],
  "encounterTableIds": [
    "veloria/r14_crystal_patch"
  ],
  "npcRefs": [
    "r14_guide"
  ],
  "scriptRefs": [
    "veloria/q_crystal_research"
  ],
  "musicId": "ambient_brumalta",
  "battleBackgroundKey": "veloria-r14-crystal-pass-v1"
}
