{
  "id": "veloria/league_council04",
  "version": 2,
  "displayName": "Sala di Luce",
  "biomeId": "league_chamber",
  "tiledAsset": "tilemaps/league_council04.tmj",
  "terrainBase": {
    "assetKey": "veloria-league_council04-illustrated-v3",
    "tilesetName": "veloria_terrain",
    "tileIndex": 0
  },
  "renderAssets": [
    {
      "kind": "tileset",
      "key": "veloria-ground-hd-v5",
      "path": "assets/tilesets/veloria-ground-hd-v5.webp",
      "tiledName": "veloria_terrain",
      "tileWidth": 254,
      "tileHeight": 510
    },
    {
      "kind": "image",
      "key": "veloria-npcs-v2",
      "path": "assets/sprites/veloria-npcs-v2.webp",
      "atlas": {
        "columns": 3,
        "rows": 2
      }
    },
    {
      "kind": "image",
      "key": "veloria-league_council04-illustrated-v3",
      "path": "assets/scenery/veloria-league_council04-illustrated-v3.webp"
    },
    {
      "kind": "image",
      "key": "veloria-league-council-v1",
      "path": "assets/sprites/veloria-league-council-v1.webp",
      "atlas": {
        "columns": 2,
        "rows": 2
      }
    }
  ],
  "spawns": [
    {
      "id": "from_entry",
      "x": 15,
      "y": 21,
      "facing": "up"
    }
  ],
  "connections": [
    {
      "toMapId": "veloria/league_forecourt",
      "viaSpawnId": "from_entry",
      "targetSpawnId": "league_checkpoint",
      "requiresFlags": []
    }
  ],
  "encounterTableIds": [],
  "npcRefs": [
    "league_council4"
  ],
  "scriptRefs": [
    "veloria/q_league_championship"
  ],
  "musicId": "ambient_route02",
  "battleBackgroundKey": "veloria-league_council04-illustrated-v3"
}
