{
  "id": "veloria/portolume",
  "version": 2,
  "displayName": "Portolume · Porto delle Maree",
  "biomeId": "coastal_harbor",
  "tiledAsset": "tilemaps/portolume.tmj",
  "renderAssets": [
    {
      "kind": "tileset",
      "key": "veloria-ground-hd-v5",
      "path": "assets/tilesets/veloria-ground-hd-v5.webp",
      "tiledName": "veloria_terrain",
      "tileWidth": 254,
      "tileHeight": 510
    },
    {
      "kind": "image",
      "key": "veloria-npcs-v2",
      "path": "assets/sprites/veloria-npcs-v2.webp",
      "atlas": {
        "columns": 3,
        "rows": 2
      }
    },
    {
      "kind": "image",
      "key": "veloria-portolume-v1",
      "path": "assets/sprites/veloria-portolume-v1.webp"
    }
  ],
  "spawns": [
    {
      "id": "from_r08",
      "x": 1,
      "y": 17,
      "facing": "right"
    },
    {
      "id": "dock_mainland",
      "x": 25,
      "y": 14,
      "facing": "right"
    },
    {
      "id": "dock_observatory",
      "x": 32,
      "y": 9,
      "facing": "down"
    },
    {
      "id": "from_gym05",
      "x": 18,
      "y": 8,
      "facing": "down"
    },
    {
      "id": "from_monorail",
      "x": 7,
      "y": 22,
      "facing": "up"
    },
    {
      "id": "from_r09",
      "x": 15,
      "y": 28,
      "facing": "up"
    }
  ],
  "connections": [
    {
      "toMapId": "veloria/r08_costa_turbine",
      "viaSpawnId": "from_r08",
      "targetSpawnId": "from_portolume",
      "requiresFlags": []
    },
    {
      "toMapId": "veloria/gym05_portolume",
      "viaSpawnId": "from_gym05",
      "targetSpawnId": "from_portolume",
      "requiresFlags": []
    },
    {
      "toMapId": "veloria/r09_dune_salmastre",
      "viaSpawnId": "from_r09",
      "targetSpawnId": "from_portolume",
      "requiresFlags": [
        "badge_marea_awarded"
      ]
    }
  ],
  "encounterTableIds": [],
  "npcRefs": [
    "portolume_captain"
  ],
  "scriptRefs": [],
  "musicId": "ambient_brumalta",
  "battleBackgroundKey": "veloria-portolume-v1",
  "ambientEffects": []
}
