{
  "id": "veloria/r16_cammino_equilibrio",
  "version": 2,
  "displayName": "Cammino dell’Equilibrio",
  "biomeId": "league_approach",
  "tiledAsset": "tilemaps/r16_cammino_equilibrio.tmj",
  "renderAssets": [
    {
      "kind": "tileset",
      "key": "veloria-ground-hd-v5",
      "path": "assets/tilesets/veloria-ground-hd-v5.webp",
      "tiledName": "veloria_terrain",
      "tileWidth": 254,
      "tileHeight": 510
    },
    {
      "kind": "image",
      "key": "veloria-npcs-v2",
      "path": "assets/sprites/veloria-npcs-v2.webp",
      "atlas": {
        "columns": 3,
        "rows": 2
      }
    },
    {
      "kind": "image",
      "key": "veloria-r16_cammino_equilibrio-illustrated-v3",
      "path": "assets/scenery/veloria-r16_cammino_equilibrio-illustrated-v3.webp"
    },
    {
      "kind": "image",
      "key": "veloria-league-and-cammino-cast-v1",
      "path": "assets/sprites/veloria-league-and-cammino-cast-v1.webp",
      "atlas": {
        "columns": 2,
        "rows": 2
      }
    }
  ],
  "spawns": [
    {
      "id": "from_concordia",
      "x": 1,
      "y": 19,
      "facing": "right"
    },
    {
      "id": "from_league",
      "x": 38,
      "y": 2,
      "facing": "left"
    }
  ],
  "connections": [
    {
      "toMapId": "veloria/concordia",
      "viaSpawnId": "from_concordia",
      "targetSpawnId": "from_r16",
      "requiresFlags": []
    },
    {
      "toMapId": "veloria/league_forecourt",
      "viaSpawnId": "from_league",
      "targetSpawnId": "from_r16",
      "requiresFlags": []
    }
  ],
  "encounterTableIds": [
    "veloria/r16_garden_patch"
  ],
  "npcRefs": [
    "r16_maia",
    "r16_tobia"
  ],
  "scriptRefs": [
    "veloria/q_league_approach"
  ],
  "musicId": "ambient_route02",
  "battleBackgroundKey": "veloria-r16_cammino_equilibrio-illustrated-v3"
}
