{
  "id": "veloria/r05_viadotto_ciliegi",
  "version": 2,
  "displayName": "Viadotto dei Ciliegi",
  "biomeId": "cherry_viaduct",
  "tiledAsset": "tilemaps/r05_viadotto_ciliegi.tmj",
  "terrainBase": {
    "assetKey": "veloria-forest-floor-v1",
    "tilesetName": "veloria_terrain",
    "tileIndex": 6
  },
  "renderAssets": [
    {
      "kind": "tileset",
      "key": "veloria-ground-hd-v5",
      "path": "assets/tilesets/veloria-ground-hd-v5.webp",
      "tiledName": "veloria_terrain",
      "tileWidth": 254,
      "tileHeight": 510
    },
    {
      "kind": "image",
      "key": "veloria-forest-floor-v1",
      "path": "assets/tilesets/veloria-forest-floor-v1.webp"
    },
    {
      "kind": "image",
      "key": "veloria-battle-forest-v1",
      "path": "assets/battle/veloria-battle-forest-v1.webp"
    },
    {
      "kind": "image",
      "key": "veloria-field-props-v1",
      "path": "assets/sprites/veloria-field-props-v1.webp",
      "atlas": {
        "columns": 2,
        "rows": 2
      }
    },
    {
      "kind": "image",
      "key": "veloria-cherry-tree-v1",
      "path": "assets/sprites/veloria-cherry-tree-v1.webp"
    },
    {
      "kind": "image",
      "key": "veloria-borgofonte-plants-v1",
      "path": "assets/sprites/veloria-borgofonte-plants-v1.webp",
      "atlas": {
        "columns": 2,
        "rows": 2
      }
    },
    {
      "kind": "image",
      "key": "veloria-npcs-v2",
      "path": "assets/sprites/veloria-npcs-v2.webp",
      "atlas": {
        "columns": 3,
        "rows": 2
      }
    },
    {
      "kind": "image",
      "key": "veloria-npc-rami-v1",
      "path": "assets/sprites/veloria-npc-rami-v1.webp"
    },
    {
      "kind": "image",
      "key": "veloria-r05_viadotto_ciliegi-illustrated-v2",
      "path": "assets/scenery/veloria-r05_viadotto_ciliegi-illustrated-v2.webp"
    }
  ],
  "spawns": [
    {
      "id": "from_petalora",
      "x": 1,
      "y": 18,
      "facing": "right"
    },
    {
      "id": "from_vetracielo",
      "x": 44,
      "y": 6,
      "facing": "left"
    }
  ],
  "connections": [
    {
      "toMapId": "veloria/petalora",
      "viaSpawnId": "from_petalora",
      "targetSpawnId": "from_r05",
      "requiresFlags": []
    },
    {
      "toMapId": "veloria/vetracielo",
      "viaSpawnId": "from_vetracielo",
      "targetSpawnId": "from_r05",
      "requiresFlags": []
    }
  ],
  "encounterTableIds": [
    "veloria/r05_cherry_viaduct"
  ],
  "npcRefs": [
    "oren_r05"
  ],
  "scriptRefs": [],
  "musicId": "ambient_route02",
  "battleBackgroundKey": "veloria-battle-forest-v1",
  "ambientEffects": [
    {
      "kind": "grass-sway",
      "tuftsPerArea": 6,
      "triggerIds": [
        "Foglie del Belvedere",
        "Giardino dei Binari",
        "Sponde del Viadotto",
        "Ultimi Ciliegi"
      ],
      "colors": [
        "#b3c982",
        "#dfbaaa"
      ]
    },
    {
      "kind": "water-shimmer",
      "count": 12,
      "area": {
        "x": 704,
        "y": 256,
        "width": 96,
        "height": 512
      },
      "colors": [
        "#c8f4ec",
        "#d5e9ed"
      ]
    }
  ]
}
