{
  "id": "veloria/d04_delta_specchi",
  "version": 2,
  "displayName": "Delta degli Specchi",
  "biomeId": "river_delta",
  "tiledAsset": "tilemaps/d04_delta_specchi.tmj",
  "renderAssets": [
    {
      "kind": "tileset",
      "key": "veloria-ground-hd-v5",
      "path": "assets/tilesets/veloria-ground-hd-v5.webp",
      "tiledName": "veloria_terrain",
      "tileWidth": 254,
      "tileHeight": 510
    },
    {
      "kind": "image",
      "key": "veloria-npcs-v2",
      "path": "assets/sprites/veloria-npcs-v2.webp",
      "atlas": {
        "columns": 3,
        "rows": 2
      }
    },
    {
      "kind": "image",
      "key": "veloria-d04_delta_specchi-illustrated-v3",
      "path": "assets/scenery/veloria-d04_delta_specchi-illustrated-v3.webp"
    },
    {
      "kind": "image",
      "key": "veloria-coastal-cast-v1",
      "path": "assets/sprites/veloria-coastal-cast-v1.webp",
      "atlas": {
        "columns": 2,
        "rows": 2
      }
    },
    {
      "kind": "image",
      "key": "veloria-delta-route-cast-v1",
      "path": "assets/sprites/veloria-delta-route-cast-v1.webp",
      "atlas": {
        "columns": 2,
        "rows": 2
      }
    }
  ],
  "spawns": [
    {
      "id": "from_r09",
      "x": 1,
      "y": 18,
      "facing": "right"
    },
    {
      "id": "from_r10",
      "x": 38,
      "y": 7,
      "facing": "left"
    }
  ],
  "connections": [
    {
      "toMapId": "veloria/r09_dune_salmastre",
      "viaSpawnId": "from_r09",
      "targetSpawnId": "from_delta",
      "requiresFlags": []
    },
    {
      "toMapId": "veloria/r10_sentiero_canne",
      "viaSpawnId": "from_r10",
      "targetSpawnId": "from_delta",
      "requiresFlags": [
        "q_delta_report"
      ]
    }
  ],
  "encounterTableIds": [
    "veloria/d04_delta_fishing"
  ],
  "npcRefs": [
    "delta_iris",
    "delta_teo"
  ],
  "scriptRefs": [],
  "musicId": "ambient_route02",
  "battleBackgroundKey": "veloria-d04_delta_specchi-illustrated-v3"
}
