{
  "id": "veloria/d03_centrale_risonante",
  "version": 2,
  "displayName": "Centrale Risonante",
  "biomeId": "resonant_power_station",
  "tiledAsset": "tilemaps/d03_centrale_risonante.tmj",
  "renderAssets": [
    {
      "kind": "tileset",
      "key": "veloria-ground-hd-v5",
      "path": "assets/tilesets/veloria-ground-hd-v5.webp",
      "tiledName": "veloria_terrain",
      "tileWidth": 254,
      "tileHeight": 510
    },
    {
      "kind": "image",
      "key": "veloria-field-props-v1",
      "path": "assets/sprites/veloria-field-props-v1.webp",
      "atlas": {
        "columns": 2,
        "rows": 2
      }
    },
    {
      "kind": "image",
      "key": "veloria-borgofonte-plants-v1",
      "path": "assets/sprites/veloria-borgofonte-plants-v1.webp",
      "atlas": {
        "columns": 2,
        "rows": 2
      }
    },
    {
      "kind": "image",
      "key": "veloria-npcs-v2",
      "path": "assets/sprites/veloria-npcs-v2.webp",
      "atlas": {
        "columns": 3,
        "rows": 2
      }
    },
    {
      "kind": "image",
      "key": "veloria-industrial-floor-v1",
      "path": "assets/tilesets/veloria-industrial-floor-v1.webp"
    },
    {
      "kind": "image",
      "key": "veloria-centrale-room-v1",
      "path": "assets/sprites/veloria-centrale-room-v1.webp"
    },
    {
      "kind": "image",
      "key": "pokeapi-gen1-145-v1",
      "path": "assets/creatures/pokeapi-gen1-145-v1.webp"
    },
    {
      "kind": "image",
      "key": "veloria-centrale-technician-v1",
      "path": "assets/sprites/veloria-centrale-technician-v1.webp"
    }
  ],
  "spawns": [
    {
      "id": "from_r07",
      "x": 15,
      "y": 21,
      "facing": "up"
    }
  ],
  "connections": [
    {
      "toMapId": "veloria/r07_condotto_risonante",
      "viaSpawnId": "from_r07",
      "targetSpawnId": "from_centrale",
      "requiresFlags": []
    }
  ],
  "encounterTableIds": [],
  "npcRefs": [
    "centrale_technician"
  ],
  "scriptRefs": [
    "quest/centrale_investigation"
  ],
  "musicId": "ambient_brumalta",
  "terrainBase": {
    "assetKey": "veloria-industrial-floor-v1",
    "tilesetName": "veloria_terrain",
    "tileIndex": 1
  }
}
