{
  "id": "veloria/gym05_portolume",
  "version": 2,
  "displayName": "Palestra di Portolume",
  "biomeId": "water_gym",
  "tiledAsset": "tilemaps/gym05_portolume.tmj",
  "renderAssets": [
    {
      "kind": "tileset",
      "key": "veloria-ground-hd-v5",
      "path": "assets/tilesets/veloria-ground-hd-v5.webp",
      "tiledName": "veloria_terrain",
      "tileWidth": 254,
      "tileHeight": 510
    },
    {
      "kind": "image",
      "key": "veloria-npcs-v2",
      "path": "assets/sprites/veloria-npcs-v2.webp",
      "atlas": {
        "columns": 3,
        "rows": 2
      }
    },
    {
      "kind": "image",
      "key": "veloria-gym05-sluices-v1",
      "path": "assets/sprites/veloria-gym05-sluices-v1.webp"
    },
    {
      "kind": "image",
      "key": "veloria-gym-leaders-b-v1",
      "path": "assets/sprites/veloria-gym-leaders-b-v1.webp",
      "atlas": {
        "columns": 2,
        "rows": 2
      }
    }
  ],
  "spawns": [
    {
      "id": "from_portolume",
      "x": 15,
      "y": 22,
      "facing": "up"
    }
  ],
  "connections": [
    {
      "toMapId": "veloria/portolume",
      "viaSpawnId": "from_portolume",
      "targetSpawnId": "from_gym05",
      "requiresFlags": []
    }
  ],
  "encounterTableIds": [],
  "npcRefs": [
    "nerea_gym"
  ],
  "scriptRefs": [],
  "musicId": "ambient_route02"
}
