{
  "id": "veloria/concordia",
  "version": 2,
  "displayName": "Concordia",
  "biomeId": "convergence_city",
  "tiledAsset": "tilemaps/concordia.tmj",
  "terrainBase": {
    "assetKey": "veloria-concordia-v1",
    "tilesetName": "veloria_terrain",
    "tileIndex": 0
  },
  "renderAssets": [
    {
      "kind": "tileset",
      "key": "veloria-ground-hd-v5",
      "path": "assets/tilesets/veloria-ground-hd-v5.webp",
      "tiledName": "veloria_terrain",
      "tileWidth": 254,
      "tileHeight": 510
    },
    {
      "kind": "image",
      "key": "veloria-npcs-v2",
      "path": "assets/sprites/veloria-npcs-v2.webp",
      "atlas": {
        "columns": 3,
        "rows": 2
      }
    },
    {
      "kind": "image",
      "key": "veloria-concordia-v1",
      "path": "assets/scenery/veloria-concordia-v1.webp"
    }
  ],
  "spawns": [
    {
      "id": "from_r15",
      "x": 1,
      "y": 15,
      "facing": "right"
    },
    {
      "id": "from_gym08",
      "x": 20,
      "y": 6,
      "facing": "down"
    },
    {
      "id": "metro_arrival",
      "x": 20,
      "y": 24,
      "facing": "up"
    },
    {
      "id": "from_sanctuary",
      "x": 31,
      "y": 14,
      "facing": "down"
    }
  ],
  "connections": [
    {
      "toMapId": "veloria/r15_passo_due_luci",
      "viaSpawnId": "from_r15",
      "targetSpawnId": "from_concordia",
      "requiresFlags": []
    },
    {
      "toMapId": "veloria/gym08_concordia",
      "viaSpawnId": "from_gym08",
      "targetSpawnId": "from_city",
      "requiresFlags": [
        "q_concordia_restore_plan"
      ]
    },
    {
      "toMapId": "veloria/d06_santuario_due_luci",
      "viaSpawnId": "from_sanctuary",
      "targetSpawnId": "from_concordia",
      "requiresFlags": [
        "badge_drago_awarded"
      ]
    }
  ],
  "encounterTableIds": [],
  "npcRefs": [
    "concordia_elia"
  ],
  "scriptRefs": [
    "veloria/q_concordia_research"
  ],
  "musicId": "ambient_route02",
  "battleBackgroundKey": "veloria-concordia-v1"
}
