{
  "id": "veloria/gym06_acquariva",
  "version": 2,
  "displayName": "Palestra di Acquariva",
  "biomeId": "psychic_gym",
  "tiledAsset": "tilemaps/gym06_acquariva.tmj",
  "renderAssets": [
    {
      "kind": "tileset",
      "key": "veloria-ground-hd-v5",
      "path": "assets/tilesets/veloria-ground-hd-v5.webp",
      "tiledName": "veloria_terrain",
      "tileWidth": 254,
      "tileHeight": 510
    },
    {
      "kind": "image",
      "key": "veloria-npcs-v2",
      "path": "assets/sprites/veloria-npcs-v2.webp",
      "atlas": {
        "columns": 3,
        "rows": 2
      }
    },
    {
      "kind": "image",
      "key": "veloria-gym06-reflections-v1",
      "path": "assets/sprites/veloria-gym06-reflections-v1.webp"
    }
  ],
  "spawns": [
    {
      "id": "from_city",
      "x": 15,
      "y": 22,
      "facing": "up"
    }
  ],
  "connections": [
    {
      "toMapId": "veloria/acquariva",
      "viaSpawnId": "from_city",
      "targetSpawnId": "from_gym06",
      "requiresFlags": []
    }
  ],
  "encounterTableIds": [],
  "npcRefs": [
    "selene_gym"
  ],
  "scriptRefs": [],
  "musicId": "ambient_route02",
  "battleBackgroundKey": "veloria-gym06-reflections-v1"
}
