{
  "id": "veloria/acquariva",
  "version": 2,
  "displayName": "Acquariva",
  "biomeId": "lake_town",
  "tiledAsset": "tilemaps/acquariva.tmj",
  "renderAssets": [
    {
      "kind": "tileset",
      "key": "veloria-ground-hd-v5",
      "path": "assets/tilesets/veloria-ground-hd-v5.webp",
      "tiledName": "veloria_terrain",
      "tileWidth": 254,
      "tileHeight": 510
    },
    {
      "kind": "image",
      "key": "veloria-npcs-v2",
      "path": "assets/sprites/veloria-npcs-v2.webp",
      "atlas": {
        "columns": 3,
        "rows": 2
      }
    },
    {
      "kind": "image",
      "key": "veloria-acquariva-v1",
      "path": "assets/sprites/veloria-acquariva-v1.webp"
    }
  ],
  "spawns": [
    {
      "id": "from_r10",
      "x": 1,
      "y": 16,
      "facing": "right"
    },
    {
      "id": "from_gym06",
      "x": 17,
      "y": 8,
      "facing": "down"
    },
    {
      "id": "from_r11",
      "x": 7,
      "y": 1,
      "facing": "down"
    },
    {
      "id": "metro_arrival",
      "x": 7,
      "y": 22,
      "facing": "left"
    }
  ],
  "connections": [
    {
      "toMapId": "veloria/r10_sentiero_canne",
      "viaSpawnId": "from_r10",
      "targetSpawnId": "from_acquariva",
      "requiresFlags": []
    },
    {
      "toMapId": "veloria/gym06_acquariva",
      "viaSpawnId": "from_gym06",
      "targetSpawnId": "from_city",
      "requiresFlags": [
        "q_acquariva_report"
      ]
    },
    {
      "toMapId": "veloria/r11_via_cascate",
      "viaSpawnId": "from_r11",
      "targetSpawnId": "from_acquariva",
      "requiresFlags": [
        "badge_riflesso_awarded"
      ]
    }
  ],
  "encounterTableIds": [],
  "npcRefs": [
    "acquariva_tessa"
  ],
  "scriptRefs": [],
  "musicId": "ambient_brumalta",
  "battleBackgroundKey": "veloria-acquariva-v1",
  "ambientEffects": []
}
