{
  "id": "veloria/league_champion",
  "version": 2,
  "displayName": "Sala del Campione",
  "biomeId": "league_chamber",
  "tiledAsset": "tilemaps/league_champion.tmj",
  "terrainBase": {
    "assetKey": "veloria-league_champion-illustrated-v3",
    "tilesetName": "veloria_terrain",
    "tileIndex": 0
  },
  "renderAssets": [
    {
      "kind": "tileset",
      "key": "veloria-ground-hd-v5",
      "path": "assets/tilesets/veloria-ground-hd-v5.webp",
      "tiledName": "veloria_terrain",
      "tileWidth": 254,
      "tileHeight": 510
    },
    {
      "kind": "image",
      "key": "veloria-league_champion-illustrated-v3",
      "path": "assets/scenery/veloria-league_champion-illustrated-v3.webp"
    },
    {
      "kind": "image",
      "key": "veloria-cast-opening-and-champion-v1",
      "path": "assets/sprites/veloria-cast-opening-and-champion-v1.webp",
      "atlas": {
        "columns": 2,
        "rows": 2
      }
    }
  ],
  "spawns": [
    {
      "id": "from_entry",
      "x": 15,
      "y": 21,
      "facing": "up"
    }
  ],
  "connections": [
    {
      "toMapId": "veloria/league_forecourt",
      "viaSpawnId": "from_entry",
      "targetSpawnId": "league_checkpoint",
      "requiresFlags": []
    }
  ],
  "encounterTableIds": [],
  "npcRefs": [
    "league_champion"
  ],
  "scriptRefs": [
    "veloria/q_league_championship"
  ],
  "musicId": "ambient_route02",
  "battleBackgroundKey": "veloria-league_champion-illustrated-v3"
}
