{
  "id": "veloria/r03_terrazze_muschio",
  "version": 2,
  "displayName": "Terrazze del Muschio",
  "biomeId": "forest_terraces",
  "tiledAsset": "tilemaps/r03_terrazze_muschio.tmj",
  "terrainBase": {
    "assetKey": "veloria-forest-floor-v1",
    "tilesetName": "veloria_terrain",
    "tileIndex": 6
  },
  "renderAssets": [
    {
      "kind": "tileset",
      "key": "veloria-ground-hd-v5",
      "path": "assets/tilesets/veloria-ground-hd-v5.webp",
      "tiledName": "veloria_terrain",
      "tileWidth": 254,
      "tileHeight": 510
    },
    {
      "kind": "image",
      "key": "veloria-forest-floor-v1",
      "path": "assets/tilesets/veloria-forest-floor-v1.webp"
    },
    {
      "kind": "image",
      "key": "veloria-battle-forest-v1",
      "path": "assets/battle/veloria-battle-forest-v1.webp"
    },
    {
      "kind": "image",
      "key": "veloria-bosco-ancient-tree-v1",
      "path": "assets/sprites/veloria-bosco-ancient-tree-v1.webp"
    },
    {
      "kind": "image",
      "key": "veloria-field-props-v1",
      "path": "assets/sprites/veloria-field-props-v1.webp",
      "atlas": {
        "columns": 2,
        "rows": 2
      }
    },
    {
      "kind": "image",
      "key": "veloria-npc-rami-v1",
      "path": "assets/sprites/veloria-npc-rami-v1.webp"
    },
    {
      "kind": "image",
      "key": "veloria-r03_terrazze_muschio-illustrated-v2",
      "path": "assets/scenery/veloria-r03_terrazze_muschio-illustrated-v2.webp"
    }
  ],
  "spawns": [
    {
      "id": "from_brumalta",
      "x": 1,
      "y": 17,
      "facing": "right"
    },
    {
      "id": "from_radicelmo",
      "x": 30,
      "y": 6,
      "facing": "left"
    }
  ],
  "connections": [
    {
      "toMapId": "veloria/brumalta",
      "viaSpawnId": "from_brumalta",
      "targetSpawnId": "from_r03",
      "requiresFlags": []
    },
    {
      "toMapId": "veloria/radicelmo",
      "viaSpawnId": "from_radicelmo",
      "targetSpawnId": "from_r03",
      "requiresFlags": []
    }
  ],
  "encounterTableIds": [
    "veloria/r03_moss_terraces",
    "veloria/r03_stone_garden"
  ],
  "npcRefs": [
    "r03_path_guide"
  ],
  "scriptRefs": [
    "quest/radicelmo_seed_archive"
  ],
  "musicId": "ambient_forest",
  "battleBackgroundKey": "veloria-battle-forest-v1",
  "ambientEffects": [
    {
      "kind": "grass-sway",
      "tuftsPerArea": 5,
      "triggerIds": [
        "Radura delle Felci",
        "Giardino di Pietra"
      ],
      "colors": [
        "#b5cb78",
        "#d6e69a"
      ]
    },
    {
      "kind": "fireflies",
      "count": 12,
      "area": {
        "x": 544,
        "y": 64,
        "width": 256,
        "height": 192
      },
      "colors": [
        "#d9ef91",
        "#b7dc78"
      ]
    }
  ]
}
