{
  "id": "veloria/r01_sentiero_alba",
  "version": 2,
  "displayName": "Sentiero dell'Alba",
  "biomeId": "grassland",
  "tiledAsset": "tilemaps/r01_sentiero_alba.tmj",
  "battleBackgroundKey": "veloria-battle-forest-v1",
  "renderAssets": [
    {
      "kind": "tileset",
      "key": "veloria-ground-hd-v5",
      "path": "assets/tilesets/veloria-ground-hd-v5.webp",
      "tiledName": "veloria_terrain",
      "tileWidth": 254,
      "tileHeight": 510
    },
    {
      "kind": "image",
      "key": "veloria-canopy-v2",
      "path": "assets/sprites/veloria-canopy-v2.webp",
      "atlas": {
        "columns": 2,
        "rows": 2
      }
    },
    {
      "kind": "image",
      "key": "veloria-battle-forest-v1",
      "path": "assets/battle/veloria-battle-forest-v1.webp"
    },
    {
      "kind": "image",
      "key": "veloria-field-props-v1",
      "path": "assets/sprites/veloria-field-props-v1.webp",
      "atlas": {
        "columns": 2,
        "rows": 2
      }
    },
    {
      "kind": "image",
      "key": "veloria-r01_sentiero_alba-illustrated-v3",
      "path": "assets/scenery/veloria-r01_sentiero_alba-illustrated-v3.webp"
    },
    {
      "kind": "image",
      "key": "veloria-cast-opening-and-champion-v1",
      "path": "assets/sprites/veloria-cast-opening-and-champion-v1.webp",
      "atlas": {
        "columns": 2,
        "rows": 2
      }
    },
    {
      "kind": "image",
      "key": "veloria-sera-idle-south-v1",
      "path": "assets/sprites/veloria-sera-idle-south-v1.webp"
    },
    {
      "kind": "image",
      "key": "veloria-sera-idle-north-v1",
      "path": "assets/sprites/veloria-sera-idle-north-v1.webp"
    },
    {
      "kind": "image",
      "key": "veloria-sera-idle-west-v1",
      "path": "assets/sprites/veloria-sera-idle-west-v1.webp"
    },
    {
      "kind": "image",
      "key": "veloria-sera-idle-east-v1",
      "path": "assets/sprites/veloria-sera-idle-east-v1.webp"
    }
  ],
  "ambientEffects": [
    {
      "kind": "grass-sway",
      "tuftsPerArea": 6,
      "triggerIds": [
        "Erba alta ovest",
        "Erba alta nord-est",
        "Erba alta sud-ovest",
        "Erba alta sud-est"
      ],
      "colors": [
        "#7f9d4e",
        "#92aa59",
        "#6e8c45"
      ]
    }
  ],
  "spawns": [
    {
      "id": "from_borgofonte",
      "x": 1,
      "y": 10,
      "facing": "right"
    },
    {
      "id": "to_bosco",
      "x": 29,
      "y": 8,
      "facing": "down"
    }
  ],
  "connections": [
    {
      "toMapId": "veloria/borgofonte",
      "viaSpawnId": "from_borgofonte",
      "targetSpawnId": "from_r01",
      "requiresFlags": []
    },
    {
      "toMapId": "veloria/d01_bosco_veli",
      "viaSpawnId": "to_bosco",
      "targetSpawnId": "from_r01",
      "requiresFlags": []
    }
  ],
  "encounterTableIds": [
    "veloria/r01_tall_grass"
  ],
  "npcRefs": [
    "trainer_route01_a",
    "trainer_route01_b"
  ],
  "scriptRefs": [
    "wild_encounters"
  ],
  "musicId": "ambient_route01"
}
